<?xml version="1.0" encoding="UTF-8"?>
<Address xmlns="http://www.ftn.uns.ac.rs/address"
 xmlns:xsi="http://www.w3.org/2001/XMLSchema-instance"
 xsi:schemaLocation="http://www.ftn.uns.ac.rs/address file:/C:/Users/Dell/Desktop/xxxx/Address.xsd">
    <Id>-1073741773</Id>
    <Country>Country0</Country>
    <City>City0</City>
    <Street>Street0</Street>
    <StreetNumber>StreetNumber0</StreetNumber>
    <Longitude>0</Longitude>
    <Latitude>0</Latitude>
</Address>
